{
  "$schema": "https://json-schema.org/draft/2020-12/schema",
  "title": "Onboarding response",
  "description": "201 response to POST /api/v1/onboarding (DEC-17, modelled on RFC 8628). The installer shows the user code and the verification URI, then polls POST /api/v1/onboarding/token with the device code.",
  "type": "object",
  "required": [
    "device_code",
    "user_code",
    "verification_uri",
    "verification_uri_complete",
    "expires_in",
    "interval",
    "server_time"
  ],
  "properties": {
    "device_code": {
      "description": "Secret known only to the installer, used to poll for the credential. Never logged and never shown to a person.",
      "type": "string",
      "pattern": "^[A-Za-z0-9_-]{43,128}$"
    },
    "user_code": {
      "description": "Short code the operator confirms against the terminal. Identifies the request; grants nothing on its own.",
      "type": "string",
      "pattern": "^[BCDFGHJKLMNPQRSTVWXZ]{4}-[BCDFGHJKLMNPQRSTVWXZ]{4}$"
    },
    "verification_uri": {
      "description": "Dashboard page where an operator enters the user code.",
      "type": "string",
      "maxLength": 2048,
      "pattern": "^https?://[^\\s]+$"
    },
    "verification_uri_complete": {
      "description": "Same page with the user code filled in, for a link or QR code.",
      "type": "string",
      "maxLength": 2048,
      "pattern": "^https?://[^\\s]+$"
    },
    "expires_in": {
      "description": "Seconds until the request expires.",
      "type": "integer",
      "minimum": 1,
      "maximum": 86400
    },
    "interval": {
      "description": "Minimum seconds between polls. Polling faster gets 429.",
      "type": "integer",
      "minimum": 1,
      "maximum": 300
    },
    "server_time": {
      "description": "Server clock, RFC 3339 UTC.",
      "type": "string",
      "maxLength": 35,
      "pattern": "^[0-9]{4}-(0[1-9]|1[0-2])-(0[1-9]|[12][0-9]|3[01])T([01][0-9]|2[0-3]):[0-5][0-9]:([0-5][0-9]|60)(\\.[0-9]{1,9})?Z$"
    }
  }
}
